link,title
https://www.bbc.com/news/articles/cp31nknxgwlo,US court rules ex-Abercrombie CEO unfit for trial
https://www.bbc.com/news/articles/c4grd0wqy22o,US jobs grow by more than expected despite tariff turmoil
https://www.bbc.com/news/articles/cwy79j2n7d4o,Temu to stop selling goods from China directly to US customers
https://www.bbc.com/news/articles/cvgnyplvdv8o,M&S supplier resorts to pen and paper after cyber attack
https://www.bbc.com/news/articles/crkx3vy54nzo,"Co-op cyber attack affects customer data, firm admits, after hackers contact BBC"
https://www.bbc.com/news/articles/cly1jwe7582o,Trump signs order to block funding to public radio
https://www.bbc.com/news/articles/ckgrwxp5r15o,Meta threatens to cut off Facebook in Nigeria over huge fines
https://www.bbc.com/news/articles/cg419qw9g15o,Talks or no talks: Who blinks first in US-China trade war?
https://www.bbc.com/news/articles/c86jx18y9e2o,Apple says most US-bound iPhones no longer made in China
https://www.bbc.com/news/articles/cqj4nev7p70o,"Warren Buffett, 94, stepping down as Berkshire Hathaway CEO"
https://www.bbc.com/news/articles/c4g4le9n469o,Uber starts allowing customers to pay in cash
https://www.bbc.com/news/articles/cj0z65dq771o,Wall Street stocks bounce back from Trump tariff losses
https://www.bbc.com/news/articles/c4grdke5r1jo,Tariffs on car parts entering the US come into force
