link,title
https://businessmirror.com.ph/2023/11/29/makati-life-medical-center-ritemed-to-transform-healthcare-with-pioneering-partnership/,"Makati Life Medical Center, RiteMed to transform healthcare with pioneering partnership"
https://businessmirror.com.ph/2023/11/28/mwell-launches-mwell-healthhub-revolutionizing-health-and-wellness-access-for-filipinos/,"mWell launches mWell HealthHub, revolutionizing health and wellness access for Filipinos"
https://businessmirror.com.ph/2023/11/25/a-milestone-in-healthcare/,A milestone in healthcare
https://businessmirror.com.ph/2023/11/23/doh-boosts-zero-open-defecation-campaign-through-health-caravan/,DOH boosts Zero Open Defecation campaign through health caravan
https://businessmirror.com.ph/2023/11/23/vaccination-drive-key-to-fighting-pneumonia-in-children-seniors/,"Vaccination drive key to fighting pneumonia in children, seniors"
https://businessmirror.com.ph/2023/11/23/multi-sectoral-group-intensifies-information-drive-against-diabetes/,Multi-sectoral group intensifies information drive against diabetes
https://businessmirror.com.ph/2023/11/23/asian-hospital-bags-3rd-place-in-decoration-contest/,Asian Hospital bags 3rd place in decoration contest
https://businessmirror.com.ph/2023/11/23/phl-govt-urged-to-develop-time-bound-plan-to-eliminate-cervical-cancer/,PHL gov’t urged to develop time-bound plan to eliminate cervical cancer
https://businessmirror.com.ph/2023/11/23/sanofi-pcedm-team-up-to-give-used-insulin-pens-a-new-life/,"Sanofi, PCEDM team up to give used insulin pens a new life"
https://businessmirror.com.ph/2023/11/23/herbalife-nutrition-marks-29-years-of-healthy-living-through-activities/,Herbalife Nutrition marks 29 years of healthy living through activities
https://businessmirror.com.ph/2023/11/22/pastoralists-have-raised-livestock-in-harsh-climates-for-millennia-what-can-they-teach-us-today/,Pastoralists have raised livestock in harsh climates for millennia. What can they teach us today?
https://businessmirror.com.ph/2023/11/22/bong-go-pushes-multifaceted-strategy-as-he-flags-rising-hiv-cases-in-teens/,Bong Go pushes multifaceted strategy as he flags rising HIV cases in teens
https://businessmirror.com.ph/2023/11/22/mohs-analytics-expands-its-range-of-diagnostic-home-test-kits/,MOHS Analytics expands its range of diagnostic home test kits
https://businessmirror.com.ph/2023/11/20/members-to-expect-higher-benefits-from-philhealth/,Members to expect higher benefits from PhilHealth
https://businessmirror.com.ph/2023/11/16/zeroing-in-on-keeping-our-key-organs-healthy-part-ii/,Zeroing in on keeping our key organs healthy: Part II
https://businessmirror.com.ph/2023/11/16/astrazeneca-ac-healths-healthway-medical-network-join-forces-to-combat-cancer-2/,"AstraZeneca, AC Health’s Healthway Medical Network join forces to combat cancer"
https://businessmirror.com.ph/2023/11/16/pharmacists-play-crucial-role-in-delivering-healthcare-to-diabetic-patients-expert/,Pharmacists play crucial role in delivering healthcare to diabetic patients–expert
https://businessmirror.com.ph/2023/11/16/senior-citizens-urged-to-get-their-flu-vaccines-to-fight-flu-like-illnesses/,Senior citizens urged to get their flu vaccines to fight flu-like illnesses
https://businessmirror.com.ph/2023/11/12/bong-go-bats-for-continuous-support-for-filipino-healthcare-workers/,Bong Go bats for continuous support for Filipino healthcare workers
https://businessmirror.com.ph/2023/11/11/senior-citizen-pwd-discounts-must-be-applied-prior-to-hospital-discharge-philhealth/,"Senior citizen, PWD discounts must be applied prior to hospital discharge – PhilHealth"
https://businessmirror.com.ph/2023/11/10/mpic-celebrates-success-of-mphs-nursing-excellence-with-soledad-velez-pangilinan-the-mph-nursing-excellence-awards/,MPIC celebrates success of MPH’s Nursing Excellence with ‘Soledad Velez-Pangilinan: The MPH Nursing Excellence Awards’
https://businessmirror.com.ph/2023/11/10/9th-asvac-2023-conference-shaping-the-future-of-immunization-2/,9th ASVAC 2023 Conference: Shaping the future of immunization
https://businessmirror.com.ph/2023/11/10/bong-go-reminds-filipinos-to-be-vigilant-as-measles-and-rubella-cases-surge/,Bong Go reminds Filipinos to be vigilant as measles and rubella cases surge
https://businessmirror.com.ph/2023/11/09/early-detection-societal-support-needed-to-combat-cerebral-palsy-in-the-phl/,"Early detection, societal support needed to combat cerebral palsy in the PHL"
https://businessmirror.com.ph/2023/11/09/clean-eating-sleep-recovery-exercise-are-keys-to-clean-healthy-living-expert/,"Clean eating, sleep, recovery, exercise are keys to clean, healthy living–expert"
https://businessmirror.com.ph/2023/11/09/psoriasis-phl-advocates-for-inclusive-quality-and-accessible-health-care/,"Psoriasis PHL advocates for inclusive, quality, and accessible health care"
https://businessmirror.com.ph/2023/11/09/improve-phl-health-system-with-bigger-budget-more-investments-study/,"Improve PHL health system with bigger budget, more investments–study"
https://businessmirror.com.ph/2023/10/19/mph-to-boost-expansion-plans-empowerment-of-nurses/,"MPH to boost expansion plans, empowerment of nurses"
https://businessmirror.com.ph/2023/10/19/bong-go-advocates-for-amplified-mental-health-initiatives/,Bong Go advocates for amplified mental health initiatives
https://businessmirror.com.ph/2023/10/17/members-urged-to-use-philhealth-member-portal-to-safely-access-data/,Members urged to use PhilHealth member portal to safely access data
https://businessmirror.com.ph/2023/10/16/astrazeneca-data-at-wclc-advance-ambition-to-have-an-az-med-for-over-half-of-patients-treated-for-lung-cancer-by-2030/,AstraZeneca data at WCLC advance ambition to have an AZ med for over half of patients treated for lung cancer by 2030
https://businessmirror.com.ph/2023/10/16/bong-go-lauds-dohs-five-year-mental-health-framework/,Bong Go lauds DOH’s five-year mental health framework
https://businessmirror.com.ph/2023/10/16/govt-academe-medical-and-research-community-biopharma-industry-eye-phl-as-center-of-clinical-trials-in-asean/,"Gov’t, academe, medical and research community, biopharma industry eye PHL as center of clinical trials in ASEAN "
https://businessmirror.com.ph/2023/10/15/college-of-pt-honoring-manila-central-university-graduates-stories-of-success-and-impact/,College of PT: Honoring Manila Central University graduates – Stories of success and impact
https://businessmirror.com.ph/2023/10/12/doh-pushes-for-additional-%e2%82%a7400m-budget-for-hpv-vaccination-drive/,DOH pushes for additional ₧400M budget for HPV vaccination drive
https://businessmirror.com.ph/2023/10/12/climate-change-crisis-to-have-a-great-impact-on-peoples-health-expert/,Climate change crisis to have a great impact on people’s health–expert
https://businessmirror.com.ph/2023/10/09/philhealth-calls-for-public-cooperation-to-contain-data-breach/,PhilHealth calls for public cooperation to contain data breach
https://businessmirror.com.ph/2023/10/09/bong-go-advocates-for-improved-working-conditions-benefits-for-barangay-health-workers-during-bhw-cebu-summit/,"Bong Go advocates for improved working conditions, benefits for Barangay Health Workers during BHW Cebu Summit"
https://businessmirror.com.ph/2023/10/06/manilamed-celebrates-56-years-of-dedication-and-excellence/,ManilaMed celebrates 56 years of dedication and excellence
https://businessmirror.com.ph/2023/10/05/philippine-cancer-society-honors-prc-chairman-gordon-as-man-of-exemplary-influence/,Philippine Cancer Society honors PRC Chairman Gordon as ‘Man of Exemplary Influence’
https://businessmirror.com.ph/2023/10/05/lourdes-hospital-deped-join-forces-for-a-healthier-philippines/,"Lourdes Hospital, DepEd join forces for a healthier Philippines"
https://businessmirror.com.ph/2023/10/05/makatimed-teams-up-with-singapores-healthcare-network-parkway-hospitals-2/,"MakatiMed teams up with Singapore’s healthcare network, Parkway Hospitals  "
https://businessmirror.com.ph/2023/10/05/usaid-strengthens-ties-with-nippon-paint-in-repainting-chosen-tb-dots-clinics/,USAID strengthens ties with Nippon Paint in repainting chosen TB-DOTS clinics
https://businessmirror.com.ph/2023/10/05/redefining-care-restoring-hope-mph-memory-care-centers-as-beacons-for-filipino-families/,"Redefining Care, Restoring Hope: MPH Memory Care Centers as Beacons for Filipino Families"
https://businessmirror.com.ph/2023/10/05/raising-a-happy-child-can-result-in-having-a-good-child/,Raising a happy child can result in having a good child
https://businessmirror.com.ph/2023/10/03/philhealth-issues-clarificatory-statement-on-urgent-notice-issue/,PhilHealth issues clarificatory statement on ‘urgent notice’ issue
https://businessmirror.com.ph/2023/10/03/usana-philippines-accepts-challenge-of-reaching-1m-families/,USANA Philippines accepts challenge of reaching 1M families
https://businessmirror.com.ph/2023/10/02/2024-proposed-health-budget-must-be-increased-to-bring-medical-services-closer-to-communities-bong-go/,2024 proposed health budget must be increased to bring medical services closer to communities — Bong Go
https://businessmirror.com.ph/2023/10/02/perpetual-help-medical-center-unveils-new-state-of-the-art-machine-for-cardiac-procedures/,Perpetual Help Medical Center unveils new state-of-the-art machine for cardiac procedures
https://businessmirror.com.ph/2023/10/01/bong-go-reminds-filipinos-to-remain-vigilant-vs-nipah-virus-amid-outbreak-in-other-countries/,Bong Go reminds Filipinos to remain vigilant vs. Nipah virus amid outbreak in other countries 
https://businessmirror.com.ph/2023/09/30/bong-go-reminds-doh-to-release-healthcare-workers-allowances-and-benefits/,Bong Go reminds DOH to release healthcare workers’ allowances and benefits
https://businessmirror.com.ph/2023/09/29/makatimed-teams-up-with-singapores-healthcare-network-parkway-hospitals/,"MakatiMed teams up with Singapore’s healthcare network, Parkway Hospitals "
https://businessmirror.com.ph/2023/09/29/puerto-princesa-city-mayor-urges-parents-to-get-kids-vaxxed-vs-cervical-cancer/,Puerto Princesa City Mayor urges parents to get kids vaxxed vs. cervical cancer
https://businessmirror.com.ph/2023/09/28/bong-go-calls-for-increased-health-budget-as-country-navigates-toward-pandemic-recovery/,Bong Go calls for increased health budget as country navigates toward pandemic recovery
https://businessmirror.com.ph/2023/09/28/novartis-associates-check-their-cholesterol-levels-raise-awareness-on-heart-health/,"Novartis associates check their cholesterol levels, raise awareness on heart health"
https://businessmirror.com.ph/2023/09/28/la-union-phap-cares-foundation-sign-moa-to-push-universal-healthcare-in-the-province/,"La Union, PHAP Cares Foundation sign MOA to push Universal Healthcare in the province"
https://businessmirror.com.ph/2023/09/28/filipino-brand-comes-up-with-solutions-to-address-menopausal-problems/,Filipino brand comes up with solutions to address menopausal problems
https://businessmirror.com.ph/2023/09/08/europe-warns-of-new-highly-mutated-coronavirus-strain-as-cases-increase/,"Europe warns of new, highly mutated coronavirus strain as cases increase"
https://businessmirror.com.ph/2023/09/08/accelerate-hpv-vaccination-to-save-more-lives-solon/,Accelerate HPV vaccination to save more lives – Solon
https://businessmirror.com.ph/2023/09/07/axa-ph-shows-power-of-women-volunteers-to-uplift-local-communities/,AXA PH shows power of women volunteers to uplift local communities
https://businessmirror.com.ph/2023/09/07/bayer-philippines-launches-initiative-to-promote-womens-health-conversations/,Bayer Philippines launches initiative to promote Women’s Health Conversations
https://businessmirror.com.ph/2023/09/07/urgent-need-to-address-growing-breast-cervical-cancer-rates-in-apac-cited/,"Urgent need to address growing breast, cervical cancer rates in APAC cited"
https://businessmirror.com.ph/2023/09/07/age-income-affect-how-often-pinoys-see-their-doctors-study/,"Age, income affect how often Pinoys see their doctors–study"
https://businessmirror.com.ph/2023/09/06/media-forum-dissects-diabetes-obesity-and-the-sweetened-beverage-tax/,"Media forum dissects diabetes, obesity, and the sweetened beverage tax"
https://businessmirror.com.ph/2023/09/06/bong-go-to-push-for-increased-budget-for-cancer-care-supports-cancer-fund-initiative-for-ofws/,Bong Go to push for increased budget for cancer care; supports Cancer Fund initiative for OFWs
https://businessmirror.com.ph/2023/09/04/households-still-bear-most-of-health-expenses-report/,Households still bear most of health expenses–report
https://businessmirror.com.ph/2023/09/02/roche-healthway-medical-network-of-ayala-healthcare-holdings-inc-inks-landmark-partnership-to-transform-cancer-care/,"Roche, Healthway Medical Network of Ayala Healthcare Holdings, Inc. inks landmark partnership to transform cancer care "
https://businessmirror.com.ph/2023/09/02/bong-go-highlights-importance-of-regional-specialty-centers-act-in-improving-healthcare-accessibility-in-grassroots/,Bong Go highlights importance of Regional Specialty Centers Act in improving healthcare accessibility in grassroots 
https://businessmirror.com.ph/2023/08/31/4-simple-ways-to-improve-your-health-and-live-your-best-life/,4 simple ways to improve your health and live your best life
https://businessmirror.com.ph/2023/08/31/metro-pacific-health-asian-hospital-host-battle-of-the-nightingales/,"Metro Pacific Health, Asian Hospital host Battle of the Nightingales"
https://businessmirror.com.ph/2023/08/31/smoking-cessation-is-key-to-fighting-lung-ailments-experts/,Smoking cessation is key to fighting lung ailments–experts
https://businessmirror.com.ph/2023/08/31/sante-celebrates-16th-anniversary-by-igniting-rise-up-movement/,Santé celebrates 16th anniversary by igniting ‘Rise Up’ movement
https://businessmirror.com.ph/2023/08/31/caloocan-partners-with-nestle-for-health-wellness-programs/,"Caloocan partners with Nestle for health, wellness programs"
https://businessmirror.com.ph/2023/08/31/the-medical-city-garners-prestigious-accolade-as-asias-best-employer-brand/,The Medical City garners prestigious accolade as Asia’s Best Employer Brand
https://businessmirror.com.ph/2023/08/31/fighting-dengue-in-quezon-city-through-slay-the-swarm-strategy/,Fighting dengue in Quezon City through ‘Slay the Swarm’ strategy
https://businessmirror.com.ph/2023/08/31/benefits-positive-impact-of-ai-on-dentistry-practice-revealed-in-survey/,"Benefits, positive impact of AI on dentistry practice revealed in survey"
https://businessmirror.com.ph/2023/08/31/cetaphil-and-watsons-join-forces-for-the-sixth-year-of-the-national-healthy-skin-mission/,Cetaphil and Watsons join forces for the sixth year of the National Healthy Skin Mission
https://businessmirror.com.ph/2023/08/31/from-bump-to-baby-capturing-the-joy-of-pregnancy/,From Bump to Baby: Capturing the Joy of Pregnancy
https://businessmirror.com.ph/2023/08/31/mabuhigh-from-bangkok-pinoys-join-thailands-legal-cannabis-trade/,‘Mabuhigh’ from Bangkok: Pinoys join Thailand’s legal cannabis trade
https://businessmirror.com.ph/2023/08/31/qc-councilor-gives-away-free-bags-vitamins-to-students/,"QC councilor gives away free vitamins, bags to students "
https://businessmirror.com.ph/2023/08/29/wb-making-local-vaxx-benefits-phl-but-not-now/,"WB: Making local vaxx benefits PHL, but not now"
https://businessmirror.com.ph/2023/08/29/ospital-ng-paranaque-takes-next-step-to-becoming-a-smart-hospital-with-pldt-enterprise-solutions/,Ospital ng Paranaque takes next step to becoming a ‘Smart Hospital’ with PLDT Enterprise solutions
https://businessmirror.com.ph/2023/08/25/poor-pay-poverty-premium-in-phl-aspac-adb-report/,"Poor pay ‘poverty premium’ in PHL, AsPac–ADB report"
https://businessmirror.com.ph/2023/08/24/davao-occidental-tb-program-gets-recognition-from-doh/,Davao Occidental TB program gets recognition from DOH
https://businessmirror.com.ph/2023/08/24/health-insurance-technologies-must-be-sustained-amid-innovations-experts/,"Health, insurance technologies must be sustained amid innovations–experts"
https://businessmirror.com.ph/2023/08/24/baguio-city-phap-kick-off-phase-2-of-medicine-access-initiative-for-residents-2/,"Baguio City, PHAP kick off phase 2 of medicine access initiative for residents"
https://businessmirror.com.ph/2023/08/24/health-experts-call-for-intensified-efforts-to-raise-hpv-awareness-address-misconceptions/,"Health experts call for intensified efforts to raise HPV awareness, address misconceptions"
https://businessmirror.com.ph/2023/07/27/pfizers-innovative-medical-drone-project-recognized-as-winner-during-the-2023-lcf-csr-guild-awards/,Pfizer’s innovative medical drone project recognized as winner during the 2023 LCF CSR Guild Awards
https://businessmirror.com.ph/2023/07/27/makatimed-surgeon-is-the-first-and-only-asian-woman-accepted-to-the-prestigious-les-compagnons-hepato-biliaires-society/,MakatiMed Surgeon is the first and only Asian woman accepted to the prestigious Les Compagnons Hépato-Biliaires Society
https://businessmirror.com.ph/2023/07/27/our-lady-of-lourdes-hospital-celebrates-75th-anniversary-with-launch-of-alagang-lourdes/,Our Lady of Lourdes Hospital celebrates 75th anniversary with launch of  “Alagang Lourdes”
https://businessmirror.com.ph/2023/07/27/nestle-launches-familywellness-festival-in-quezon-city-to-celebrate-nutrition-month/,Nestlé launches FamilyWellness Festival in Quezon City to celebrate Nutrition Month
https://businessmirror.com.ph/2023/07/27/the-medical-city-answers-the-global-call-for-creating-a-greener-space-for-all/,The Medical City answers the global call for creating a greener space for all
https://businessmirror.com.ph/2023/07/27/pilipinas-shell-foundation-passes-nutrition-program-on-lgus/,Pilipinas Shell Foundation passes nutrition program on LGUs
https://businessmirror.com.ph/2023/07/27/climate-change-leads-to-growing-risk-of-mosquito-borne-viral-diseases-eu-agency/,Climate change leads to growing risk of mosquito-borne viral diseases–EU agency
https://businessmirror.com.ph/2023/07/27/asian-hospitals-asian-cancer-institute-celebrates8-years-of-supporting-lives-conquering-cancer/,"Asian Hospital’s Asian Cancer Institute celebrates 8 years of supporting lives, conquering cancer"
https://businessmirror.com.ph/2023/07/27/soda-sweetener-aspartame-now-listed-as-possible-cancer-cause-but-still-considered-safe/,Soda sweetener aspartame now listed as possible cancer cause but still considered safe
https://businessmirror.com.ph/2023/07/21/caring-beyond-beauty-watsons-and-operation-smile-philippines-transforming-lives-together/,CARING BEYOND BEAUTY | Watsons and Operation Smile Philippines transforming lives together
https://businessmirror.com.ph/2023/07/20/right-medicines-increased-awareness-keys-to-treating-hepa-b-other-liver-ailments/,"Right medicines, increased awareness keys to treating Hepa B, other liver ailments"
https://businessmirror.com.ph/2023/07/20/parents-call-on-government-to-go-after-online-shops-that-sell-vape-products/,Parents call on government to go after online shops that sell vape products
https://businessmirror.com.ph/2023/07/20/skinstation-launches-elite-an-upscale-members-exclusive-skin-care-haven/,"SkinStation Launches Elite, an upscale, members exclusive skin-care haven"
https://businessmirror.com.ph/2023/07/20/early-breast-cancer-diagnosis-is-key-to-reducing-government-expenses-expert/,Early breast cancer diagnosis is key to reducing government expenses—expert
https://businessmirror.com.ph/2023/07/17/demystifying-aging-insights-into-the-diverse-pathways-of-aging-and-the-quest-for-effective-anti-aging-interventions/,DEMYSTIFYING AGING: Insights into the diverse pathways of aging and the quest for effective anti-aging interventions
https://businessmirror.com.ph/2023/07/15/skin-like-butterfly-wings-up-scientists-investigate-rare-deadly-disease/,Skin like butterfly wings: UP scientists investigate rare deadly disease
https://businessmirror.com.ph/2023/07/13/acupuncture-restores-the-natural-healing-abilities-of-the-body-says-practitioner/,"Acupuncture restores the natural healing abilities of the body, says practitioner"
https://businessmirror.com.ph/2023/07/13/attain-demographic-dividend-gender-equality-by-investing-in-people-opportunities-experts/,"Attain demographic dividend, gender equality by investing in people, opportunities–experts"
https://businessmirror.com.ph/2023/07/13/a-child-succumbs-to-cancer-every-three-hours-doh/,A child succumbs to cancer every three hours–DOH
https://businessmirror.com.ph/2023/07/13/updated-vaccines-required-for-better-stronger-protection-vs-covid-19-virus/,"Updated vaccines required for better, stronger protection vs Covid-19 virus"
https://businessmirror.com.ph/2023/07/12/ched-eyes-grants-to-help-nursing-board-examinees/,CHED eyes grants to help nursing board examinees
https://businessmirror.com.ph/2023/07/11/doh-logs-2510-new-covid-cases-from-july-3-to-9/,"DOH logs 2,510 new Covid cases from July 3 to 9"
https://businessmirror.com.ph/2023/07/10/only-1-of-pinays-are-screened-for-cancer/,Only 1% of Pinays are screened for cancer
https://businessmirror.com.ph/2023/07/07/mwell-unveils-mwellmd-advanced-a-cutting-edge-electronic-medical-records-emr-and-clinic-management-system/,mWell unveils mWellMD Advanced: a cutting-edge Electronic Medical Records (EMR) and clinic management system                       designed by doctors for doctors
https://businessmirror.com.ph/2023/07/06/lazada-adds-fitness-to-life-of-pinoy-netsumers-with-first-ever-running-event/,Lazada adds fitness to life of Pinoy ‘netsumers’ with first-ever running event
https://businessmirror.com.ph/2023/07/06/bir-exempts-59-drugs-for-cancer-hypertension-high-cholesterol-diabetes-mental-illness-tuberculosis-kidney-disease-from-vat/,"BIR exempts 59 drugs for Cancer, Hypertension, High Cholesterol, Diabetes, Mental Illness, Tuberculosis, Kidney Disease from VAT"
https://businessmirror.com.ph/2023/07/06/more-gen-zs-putting-premium-on-health-wellness-through-compounded-drugs/,"More Gen Zs putting premium on health, wellness through compounded drugs"
https://businessmirror.com.ph/2023/07/06/doh-to-push-for-mass-drug-drive-against-neglected-tropical-diseases/,DOH to push for mass drug drive against neglected tropical diseases
https://businessmirror.com.ph/2023/07/06/metro-pacific-health-invests-in-its-21st-hospital/,Metro Pacific Health invests in its 21st hospital
https://businessmirror.com.ph/2023/07/06/health-insurance-bpo-philippines-cynergy-bpo-on-countrys-vital-role-in-reshaping-global-healthcare/,Health Insurance BPO Philippines: Cynergy BPO on country’s vital role in reshaping global healthcare
https://businessmirror.com.ph/2023/06/20/ph-healthcare-mega-app-mwell-brings-holistic-wellness-to-the-workplace-via-mwellwork/,PH healthcare mega app mWell brings holistic wellness to the workplace via mWell@Work
https://businessmirror.com.ph/2023/06/19/mwell-brings-holistic-wellness-to-workplace-via-mwellwork/,mWell brings holistic wellness to workplace via mWell@Work
https://businessmirror.com.ph/2023/06/15/advocates-push-for-legalization-of-cannabis-has-many-benefits/,"Advocates push for legalization of cannabis, has many benefits"
https://businessmirror.com.ph/2023/06/15/herbosa-cayetano-cyclists-lead-celebration-of-world-bicycle-day/,"Herbosa, Cayetano, cyclists lead celebration of World Bicycle Day"
https://businessmirror.com.ph/2023/06/15/multi-stakeholder-collaboration-sought-in-war-vs-cervical-cancer/,Multi-stakeholder collaboration sought in war vs cervical cancer
https://businessmirror.com.ph/2023/06/15/heart-valve-replacement-saved-a-womans-life-at-81/,Heart valve replacement saved a woman’s life at 81
https://businessmirror.com.ph/2023/06/15/doctors-call-on-government-to-address-void-in-vaccine-campaign-for-pregnant-women/,Doctors call on government to address void in vaccine campaign for pregnant women
https://businessmirror.com.ph/2023/06/14/ted-cites-hindrance-in-dohs-bid-to-secure-more-bivalent-vax/,Herbosa cites hindrance in DOH’s bid to secure more bivalent vaccines
https://businessmirror.com.ph/2023/06/09/newer-heart-transplant-method-could-allow-more-patients-a-chance-at-lifesaving-surgery-2/,Newer heart transplant method could allow more patients a chance at lifesaving surgery
https://businessmirror.com.ph/2023/06/09/cervical-cancer-coverage-a-top-priority-of-philhealth-in-universal-health-care/,Cervical cancer coverage:  A top priority of PhilHealth in Universal Health Care
https://businessmirror.com.ph/2023/06/08/thriving-with-anxiety-dealing-with-lifes-ups-and-downs/,Thriving with anxiety: Dealing with life’s ups and downs
https://businessmirror.com.ph/2023/06/08/oky-period-tracker-app-launched-to-help-educate-adolescents-on-menstrual-health/,Oky Period Tracker App launched to help educate adolescents on menstrual health
https://businessmirror.com.ph/2023/06/08/asian-hospital-launches-alagang-deserve-alagang-sulit-campaign/,"Asian Hospital launches ‘Alagang Deserve, Alagang Sulit’ campaign"
https://businessmirror.com.ph/2023/06/08/smokers-told-to-break-habit-and-indulge-in-healthy-food/,Smokers told to break habit and indulge in healthy food
https://businessmirror.com.ph/2023/06/07/doh-deploys-medical-professionals-to-mineral-rich-davao-de-oro-province/,DOH deploys medical professionals to mineral-rich Davao de Oro province
https://businessmirror.com.ph/2023/06/06/solmux-advance-suspension-more-zinc-more-potent-vs-cough/,"Solmux Advance Suspension: More Zinc, More Potent vs Cough"
https://businessmirror.com.ph/2023/06/05/cervical-cancer-lecture-spotlights-on-achievable-who-targets-through-multimodal-treatment/,Cervical cancer lecture spotlights on achievable WHO targets through multimodal treatment
