link,title
https://businessmirror.com.ph/2022/10/06/fda-approves-novartis-drug-for-advanced-breast-cancer-in-males/,FDA approves Novartis drug for advanced breast cancer in males
https://businessmirror.com.ph/2022/10/06/losing-weight-and-keeping-it-off-involves-total-lifestyle-change/,"Losing weight, and keeping it off, involves total lifestyle change"
https://businessmirror.com.ph/2022/09/29/lymphoma-can-be-cured-if-diagnosed-early-additional-government-support-urged/,"Lymphoma can be cured if diagnosed early, additional government support urged"
https://businessmirror.com.ph/2022/09/29/pasig-city-government-supports-ozonizer-2c-technology-to-fight-covid-19-virus/,Pasig City government supports Ozonizer 2C technology to fight Covid-19 virus
https://businessmirror.com.ph/2022/09/29/long-acting-antibody-combination-approved-for-prevention-and-treatment-of-covid-19-in-japan/,Long-acting antibody combination approved for prevention and treatment of Covid-19 in Japan
https://businessmirror.com.ph/2022/09/29/dont-forget-your-eyes-theyare-important-too-expert/,"Don’t forget your eyes, they are important too—expert"
https://businessmirror.com.ph/2022/09/26/acer-to-expand-diabetic-retinopathy-screening-with-ai-assisted-diagnostic-solution-to-local-hospitals-and-clinics/,Acer to expand diabetic retinopathy screening with AI-assisted diagnostic solution to local hospitals and clinics
https://businessmirror.com.ph/2022/09/22/diversity-inclusion-in-countrys-biopharma-industry-put-women-in-leadership-posts/,"Diversity, inclusion in country’s biopharma industry put women in leadership posts "
https://businessmirror.com.ph/2022/09/22/expert-calls-for-concerted-effort-to-fight-hiv-as-cases-are-on-the-rise/,Expert calls for concerted effort to fight HIV as cases are on the rise
https://businessmirror.com.ph/2022/09/22/cetaphil-launches-sensitive-skin-lab-as-part-of-75th-anniversary-celebration-as-authority-of-skincare/,Cetaphil launches Sensitive Skin Lab as part of 75th anniversary celebration as Authority of Skincare
https://businessmirror.com.ph/2022/09/22/smoking-is-tied-to-more-aggressive-form-of-prostate-cancer-study/,Smoking is tied to more aggressive form of prostate cancer–study
https://businessmirror.com.ph/2022/09/22/pinoys-told-to-not-work-in-bed-to-avoid-sleeplessness/,Pinoys told to not work in bed to avoid sleeplessness
https://businessmirror.com.ph/2022/09/22/st-lukes-foundation-spearheads-medical-mission-at-bjmp-taguig-city/,St. Luke’s Foundation spearheads medical mission at BJMP Taguig City
https://businessmirror.com.ph/2022/09/15/new-study-shows-covid-19-vaccines-are-effective-as-boosters-vs-severe-outcomes/,New study shows Covid-19 vaccines are effective as boosters vs severe outcomes
https://businessmirror.com.ph/2022/09/15/selling-of-internal-organs-is-illegal-bad-for-your-health-says-doh/,"Selling of internal organs is illegal, bad for your health, says DOH"
https://businessmirror.com.ph/2022/09/15/the-medical-city-south-luzon-bags-2022-ahma-for-community-involvement/,The Medical City South Luzon bags 2022 AHMA for community involvement
https://businessmirror.com.ph/2022/09/15/borough-lasik-center-making-eye-related-procedures-available-to-every-filipino/,Borough Lasik Center: Making eye-related procedures available to every Filipino
https://businessmirror.com.ph/2022/09/15/phl-enters-new-pandemic-chapter-with-end-of-outdoor-mask-mandate/,PHL enters new pandemic chapter with end of outdoor mask mandate
https://businessmirror.com.ph/2022/09/08/children-to-learn-how-to-staysafe-while-back-in-school/,Children to learn how to stay safe while back in school
https://businessmirror.com.ph/2022/09/08/aboitizpowers-units-push-proper-nutrition-in-malabon-cebu/,"AboitizPower’s units push proper nutrition in Malabon, Cebu"
https://businessmirror.com.ph/2022/09/08/increased-awareness-needed-to-fight-hpv-primary-cause-of-cervical-cancer/,"Increased awareness needed to fight HPV, primary cause of cervical cancer"
https://businessmirror.com.ph/2022/09/08/the-booster-impact-howthe-philippines-can-sustainthe-road-back-to-normalcy/,The booster impact: How the Philippines can sustain the road back to normalcy
https://businessmirror.com.ph/2022/08/06/polio-fears-rise-in-new-york-amid-possible-community-spread/,Polio fears rise in New York amid possible community spread
https://businessmirror.com.ph/2022/08/06/spain-leads-europe-in-monkeypox-struggles-to-check-spread/,"Spain leads Europe in monkeypox, struggles to check spread"
https://businessmirror.com.ph/2022/08/03/conquering-tb-in-the-time-of-covid-as-a-teenager/,Education needed to conquer hazards compounded by Covid-19
https://businessmirror.com.ph/2022/08/03/education-needed-to-conquer-hazards-compounded-by-covid-19/,Experts urge government to come up with strategic plan vs pandemic
https://businessmirror.com.ph/2022/08/03/experts-urge-government-to-come-up-with-strategic-plan-vs-pandemic/,Monkeypox is not a sexually transmitted disease–DOH
https://businessmirror.com.ph/2022/08/03/monkeypox-is-not-a-sexually-transmitted-disease-doh/,Ospital ng Makati receives highest ranking among public hospitals in Metro Manila
https://businessmirror.com.ph/2022/08/03/ospital-ng-makati-receives-highest-ranking-among-public-hospitals-in-metro-manila/,AstraZeneca’s Covid-19 vaccine prevented 50k deaths in PHL
https://businessmirror.com.ph/2022/08/03/astrazenecas-covid-19-vaccine-prevented-50k-deaths-in-phl/,Two children diagnosed with monkeypox in US
https://businessmirror.com.ph/2022/07/29/two-children-diagnosed-with-monkeypox-in-us/,WHO chief advises reducing sex partners to avoid monkeypox
https://businessmirror.com.ph/2022/07/29/who-chief-advises-reducing-sex-partners-to-avoid-monkeypox/,San Francisco declares emergency over monkeypox spread
https://businessmirror.com.ph/2022/07/29/san-francisco-declares-emergency-over-monkeypox-spread/,PHAPCares Foundation to recognize CSR initiatives for 2022
https://businessmirror.com.ph/2022/07/29/phapcares-foundation-to-recognize-csr-initiatives-for-2022/,"Constant monitoring needed for better heart health, hypertension awareness"
https://businessmirror.com.ph/2022/07/27/constant-monitoring-needed-for-better-heart-health-hypertension-awareness/,WHO issues temporary guide to aid response vs monkeypox
https://businessmirror.com.ph/2022/07/27/who-issues-temporary-guide-to-aid-response-vs-monkeypox/,Eating healthy is the foundation for good health
https://businessmirror.com.ph/2022/07/27/eating-healthy-is-the-foundation-for-good-health/,Asian Cancer Institute celebrates 7th anniversary
https://businessmirror.com.ph/2022/07/27/asian-cancer-institute-celebrates-7th-anniversary/,Nutrition program expanded to help  nourish more children nationwide
https://businessmirror.com.ph/2022/07/27/nutrition-program-expanded-to-help-nourish-more-children-nationwide/,Nutritious meals through Pinggang Pinoy
https://businessmirror.com.ph/2022/07/26/nutritious-meals-through-pinggang-pinoy/,"Philippine FDA approves Novartis advanced breast cancer treatment, alpelisib"
https://businessmirror.com.ph/2022/07/22/philippine-fda-approves-novartis-advanced-breast-cancer-treatment-alpelisib/,Get your health checked this Diabetes Awareness Week
https://businessmirror.com.ph/2022/07/22/get-your-health-checked-this-diabetes-awareness-week/,What the Bible actually says about abortion may surprise you
https://businessmirror.com.ph/2022/07/21/what-the-bible-actually-says-about-abortion-may-surprise-you/,Foot-and-mouth disease and the efforts to stop it
https://businessmirror.com.ph/2022/07/21/foot-and-mouth-disease-and-the-efforts-to-stop-it/,"Experts raise alarm over surge in diabetes, cardiovascular disease"
https://businessmirror.com.ph/2022/07/20/experts-raise-alarm-over-surge-in-diabetes-cardiovascular-disease/,Former DOH chief calls on PBBM to veto vape bill
https://businessmirror.com.ph/2022/07/20/former-doh-chief-callson-pbbm-to-veto-vape-bill/,Get better nutrition through compounded supplements to boost the body’s defense
https://businessmirror.com.ph/2022/07/20/get-better-nutrition-through-compounded-supplements-to-boost-the-bodys-defense/,"Capitol Medical Center celebrates 52nd anniversary with ISO certification, gala"
https://businessmirror.com.ph/2022/07/20/capitol-medical-center-celebrates-52nd-anniversary-with-iso-certification-gala/,3 ‘Tibay’ signs to look out for in kids’ nutrition
https://businessmirror.com.ph/2022/07/20/3-tibay-signs-to-look-out-for-in-kids-nutrition/,PHAP supports DTI’s biopharmaceutical innovation agenda
https://businessmirror.com.ph/2022/07/20/phap-supports-dtis-biopharmaceutical-innovation-agenda/,World Health Organization declares Marburg outbreak in Ghana
https://businessmirror.com.ph/2022/07/18/world-health-organization-declares-marburg-outbreak-in-ghana/,Abortion laws spark profound changes in other medical care
https://businessmirror.com.ph/2022/06/15/smdc-builds-healthy-thriving-communities-amid-the-pandemic/,"SMDC builds healthy, thriving communities amid the pandemic"
https://businessmirror.com.ph/2022/06/15/7-institutions-recognized-by-u-s-government-for-hiv-treatment-efforts/,7 institutions recognized by U.S. government for HIV treatment efforts
https://businessmirror.com.ph/2022/06/15/a-happy-gut-key-to-improving-mental-health-well-being/,"A happy gut key to improving mental health, well-being"
https://businessmirror.com.ph/2022/06/14/the-importance-of-herbal-medicine/,Medicinal Plants in the Philippines and How to Use Them
https://businessmirror.com.ph/2022/06/08/experts-advise-public-to-bevigilant-about-monkeypox/,Experts advise public to be vigilant about monkeypox
https://businessmirror.com.ph/2022/06/08/achieving-diabetes-resilience-through-lifestyle-change-medical-technologies/,"Achieving diabetes resilience through lifestyle change, medical technologies"
https://businessmirror.com.ph/2022/06/08/smfi-to-continue-medical-missions-wellness-projects-at-grassroots-level/,"SMFI to continue medical missions, wellness projects at grassroots level"
https://businessmirror.com.ph/2022/06/08/doh-warns-of-increase-in-leptospirosis-cases/,DOH warns of increase in leptospirosis cases
https://businessmirror.com.ph/2022/06/01/rainy-season-increases-riskof-getting-skin-diseases-experts/,Rainy season increases risk
https://businessmirror.com.ph/2022/06/01/govt-told-not-to-let-downguard-vs-covid-variants/,of getting skin diseases–experts
https://businessmirror.com.ph/2022/06/01/delhi-hospital-marks-100-liver-transplants-on-pinoy-children/,Govt told not to let down guard vs Covid variants
https://businessmirror.com.ph/2022/06/01/anti-smoking-campaign-a-success-in-davao-city-says-vp-elect-duterte/,Delhi hospital marks 100 liver transplants on Pinoy children
https://businessmirror.com.ph/2022/06/01/therma-luzon-uplb-to-use-research-to-improve-nutrition-in-host-communities/,"Anti-smoking campaign a success in Davao City, says VP-elect Duterte"
https://businessmirror.com.ph/2022/06/01/ms-abby/,"Therma Luzon, UPLB to use research to improve nutrition in host communities"
https://businessmirror.com.ph/2022/05/31/young-caregivers-exist-in-the-shadows-offer-crucial-help/,Ms. Abby: How Local Efforts Are Helping Filipinas Fight Cervical Cancer
https://businessmirror.com.ph/2022/05/31/spanish-lgbtq-groups-wary-of-monkeypox-stigma-as-pride-nears/,"Young caregivers ‘exist in the shadows,’ offer crucial help"
https://businessmirror.com.ph/2022/05/28/filipinos-with-axial-spondyloarthritis-face-delayed-diagnosis-heavy-disease-burden-pmas-survey/,Spanish LGBTQ groups wary of monkeypox stigma as Pride nears
https://businessmirror.com.ph/2022/05/28/mommies-you-deserve-that-rest/,"Filipinos with axial spondyloarthritis face delayed diagnosis, heavy disease burden – PMAS survey"
https://businessmirror.com.ph/2022/05/27/maxicare-advances-healthcare-and-medical-testing-with-ai-smartscan-technology-partnership/,"Mommies, you deserve that rest"
https://businessmirror.com.ph/2022/05/26/surge-fitness-lifestyle-launches-flagship-branch/,Maxicare advances healthcare and medical testing with AI SmartScan technology partnership
https://businessmirror.com.ph/2022/05/26/kathryn-bernardo-is-the-newest-advocate-for-biogesic/,Surge Fitness + Lifestyle launches flagship branch
https://businessmirror.com.ph/2022/05/25/awareness-recognition-are-keys-to-heading-off-mysterious-hepatitis/,"Awareness, recognition are keys to heading off mysterious hepatitis"
https://businessmirror.com.ph/2022/05/25/health-care-is-now-an-essential-benefit-for-employees-survey/,Health care is now an essential benefit for employees–survey
https://businessmirror.com.ph/2022/05/25/exposure-to-secondhand-smoke-increases-risk-of-getting-lung-cancer/,Exposure to secondhand smoke increases risk of getting lung cancer
https://businessmirror.com.ph/2022/05/25/mtek-opens-new-unit-to-produce-test-kits-for-covid-other-illnesses/,"MTek opens new unit to produce test kits for Covid, other illnesses"
https://businessmirror.com.ph/2022/05/25/tmc-clark-conducts-medical-mission-in-pangasinan/,TMC Clark conducts medical mission in Pangasinan 
https://businessmirror.com.ph/2022/05/25/protecting-the-protectors-why-mental-health-support-is-essential-for-content-moderators/,Protecting the protectors: Why mental health support is essential for content moderators
https://businessmirror.com.ph/2022/05/24/theories-emerge-for-mysterious-liver-illnesses-in-children/,Theories emerge for mysterious liver illnesses in children
https://businessmirror.com.ph/2022/05/23/expert-monkeypox-likely-spread-by-sex-at-2-raves-in-europe/,Expert: Monkeypox likely spread by sex at 2 raves in Europe
https://businessmirror.com.ph/2022/05/20/explainer-what-is-monkeypox-and-where-is-it-spreading/,EXPLAINER: What is monkeypox and where is it spreading?
https://businessmirror.com.ph/2022/04/06/tap-employees-when-formulating-new-normal-policies-philcare/,Tap employees when formulating new normal policies–PhilCare
https://businessmirror.com.ph/2022/04/06/media-tapped-to-helpaddress-suicide-problem/,Media tapped to help address suicide problem
https://businessmirror.com.ph/2022/04/06/dmd-skin-sciences-makes-skincare-more-accessible-to-filipinos/,DMD Skin Sciences makes skincare more accessible to Filipinos
https://businessmirror.com.ph/2022/04/06/dr-pi-water-enterprises-partners-with-safezone-philko-for-phl-expansion/,Dr.pi Water Enterprises partners with Safezone Philko for PHL expansion
https://businessmirror.com.ph/2022/04/06/st-lukes-sends-4-nurses-to-uk-for-employment/,St. Luke’s sends 4 nurses to UK for employment
https://businessmirror.com.ph/2022/04/04/with-students-in-turmoil-us-teachers-train-in-mental-health-2/,"With students in turmoil, US teachers train in mental health"
https://businessmirror.com.ph/2022/03/31/explainer-alopecia-strips-people-of-their-identity/,EXPLAINER: Alopecia ‘strips people of their identity’
https://businessmirror.com.ph/2022/03/31/brain-condition-sidelining-bruce-willis-has-many-causes/,Brain condition sidelining Bruce Willis has many causes
https://businessmirror.com.ph/2022/03/31/be-girl-scout-ready-be-covid-19-vaccinated-at-sm-supermalls/,"Be Girl Scout-ready, be COVID-19 vaccinated at SM Supermalls"
https://businessmirror.com.ph/2022/03/30/groups-pushing-for-phl-to-be-tb-free-by-2030/,Groups pushing for PHL to be TB-free by 2030
https://businessmirror.com.ph/2022/03/30/pandemic-caused-delays-in-colorectal-cancer-diagnosis-poorer-outcomes/,"Pandemic caused delays in colorectal cancer diagnosis, poorer outcomes"
https://businessmirror.com.ph/2022/03/30/oral-health-also-contributes-to-overall-well-being-say-execs/,"Oral health also contributes to overall well-being, say execs"
https://businessmirror.com.ph/2022/03/30/st-lukes-completes-phase-1-redevelopment-plan-of-qc-hospital/,St. Luke’s completes Phase 1 redevelopment plan of QC hospital
https://businessmirror.com.ph/2022/03/29/quality-sleep-sound-mind-happy-world/,"Quality sleep, sound mind, happy world"
https://businessmirror.com.ph/2022/03/29/good-sleep-helps-boost-immune-system/,Good sleep helps boost immune system
https://businessmirror.com.ph/2022/03/29/sleep-your-best-ally-in-this-pandemic/,Sleep: Your best ally in this pandemic
https://businessmirror.com.ph/2022/03/29/a-good-health-agenda-is-a-peoples-health-agenda/,A good health agenda is a people’s health agenda
https://businessmirror.com.ph/2022/03/23/some-throat-lozenges-found-effective-against-covid-19/,Some throat lozenges found effective against Covid-19
https://businessmirror.com.ph/2022/03/23/elderly-told-to-thinktwice-before-going-out/,Elderly told to think twice before going out
https://businessmirror.com.ph/2022/03/23/guidelines-out-on-how-to-deal-with-endometriosis/,Guidelines out on how to deal with endometriosis
https://businessmirror.com.ph/2022/03/23/asian-hospital-reopens-pediatric-ward/,Asian Hospital reopens Pediatric Ward
https://businessmirror.com.ph/2022/03/16/expert-says-mental-health-issues-brough-about-by-covid-19-to-take-longer-to-beat/,Expert says mental health issues brough about by Covid-19 to take longer to beat
https://businessmirror.com.ph/2022/03/16/st-lukes-conducts-firstsuccessful-intra-arterialchemotherapy-on-pedia-eye-cancer-patient/,St. Luke’s conducts first successful intra-arterial chemotherapy on pedia eye cancer patient
https://businessmirror.com.ph/2022/03/16/muntinlupa-posts-three-covid-free-communities/,Muntinlupa posts three ‘Covid-free’ communities
https://businessmirror.com.ph/2022/03/16/opposition-vs-vape-lawgrowing-veto-of-bill-pushed/,Opposition vs vape law growing; veto of bill pushed
https://businessmirror.com.ph/2022/03/16/tmc-clarks-imd-emerges-digital-solution-for-safer-efficient-health-care-service/,"TMC Clark’s iMD: Emerge’s digital solution for safer, efficient health-care service"
https://businessmirror.com.ph/2022/03/09/they-make-sure-you-dont-die-inside-nycs-drug-use-sites/,‘They make sure you don’t die’: Inside NYC’s drug use sites
https://businessmirror.com.ph/2022/03/09/prioritize-cholesterol-management-through-medicines-to-manage-diabetes-expert/,Prioritize cholesterol management through medicines to manage diabetes—expert
https://businessmirror.com.ph/2022/03/09/vapes-do-not-help-smokers-kick-the-habit-health-exec/,Vapes do not help smokers kick the habit–health exec
https://businessmirror.com.ph/2022/03/09/pldt-smart-mental-health-ph-twitter-chat-partnership-reaches-8-6-million-netizens/,"PLDT, Smart, Mental Health PH Twitter chat partnership reaches 8.6 million netizens  "
https://businessmirror.com.ph/2022/01/26/duterte-told-to-veto-vape-bill-to-save-the-youth/,Duterte told to veto vape bill to save the youth
https://businessmirror.com.ph/2022/01/26/globe-business-digital-solution-to-help-future-proof-hospitals/,Globe Business digital solution to help future-proof hospitals
https://businessmirror.com.ph/2022/01/26/new-plia-head-to-ensure-health-future-of-filipinos/,"New PLIA head to ensure health, future of Filipinos"
https://businessmirror.com.ph/2022/01/26/operation-smile-to-set-up-new-cleft-care-center-in-pampanga/,Operation Smile to set up new cleft care center in Pampanga
https://businessmirror.com.ph/2022/01/23/bf-thai-villagers-seize-opportunity-to-get-jabs-in-community-vax-drive/,BF Thai villagers seize opportunity to get jabs in community vax drive
https://businessmirror.com.ph/2022/01/19/omicron-is-contagious-not-a-mild-infection-experts/,"Omicron is contagious, not a mild infection–experts"
https://businessmirror.com.ph/2022/01/19/asian-hospital-pushes-for-digital-transformation-in-2022/,Asian Hospital pushes for digital transformation in 2022
https://businessmirror.com.ph/2022/01/19/older-population-told-to-fight-flu-with-vaccine-handwashing/,"Older population told to fight flu with vaccine, handwashing"
https://businessmirror.com.ph/2022/01/19/public-urged-to-enroll-in-top-courses-related-to-covid-19-management/,Public urged to enroll in TOP courses related to Covid-19 management
https://businessmirror.com.ph/2022/01/18/experts-highlight-importance-of-isolation-quarantine-as-covid-cases-surge/,"Experts highlight importance of isolation, quarantine as COVID cases surge"
https://businessmirror.com.ph/2022/01/15/study-stronger-evidence-linking-epstein-barr-virus-to-multiple-sclerosis/,Study: Stronger evidence linking Epstein-Barr virus to multiple sclerosis
https://businessmirror.com.ph/2022/01/12/doh-to-eliminate-viral-hepatitis-as-a-public-health-threat-by-2030/,DOH to eliminate viral hepatitis as a public health threat by 2030
https://businessmirror.com.ph/2022/01/12/greater-awareness-education-needed-on-thyroid-gland-diseases/,"Greater awareness, education needed on thyroid gland diseases"
https://businessmirror.com.ph/2022/01/12/testing-is-key-to-curbing-current-covid-19-surge/,Testing is key to curbing current Covid-19 surge
https://businessmirror.com.ph/2022/01/12/asian-hospital-to-hold-5th-clinical-innovation-summit/,Asian Hospital to hold 5th Clinical Innovation Summit
https://businessmirror.com.ph/2022/01/12/strengthen-your-immune-system-with-sante-immunity-booster-pack/,Strengthen your immune system with Santé Immunity Booster Pack
https://businessmirror.com.ph/2022/01/11/in-1st-us-surgeons-transplant-pig-heart-into-human-patient/,"In 1st, US surgeons transplant pig heart into human patient"
https://businessmirror.com.ph/2022/01/05/teachers-to-be-tapped-in-fight-against-antimicrobial-resistance/,Teachers to be tapped in fight against antimicrobial resistance
https://businessmirror.com.ph/2022/01/05/survey-says-investing-in-health-now-a-priority/,Survey says investing in health now a priority
https://businessmirror.com.ph/2022/01/05/the-medical-city-introduces-a-one-stop-care-destination-for-brain-health/,The Medical City introduces a one-stop care destination for brain health
https://businessmirror.com.ph/2022/01/05/phapcares-partners-with-cebu-pacific-pma-for-odette-response/,"PHAPCares partners with Cebu Pacific, PMA for ‘Odette’ response"
https://businessmirror.com.ph/2022/01/05/pinoys-had-a-safer-healthier-new-year-celebration-doh/,"Pinoys had a safer, healthier New Year celebration—DOH"
https://businessmirror.com.ph/2022/01/03/jakes-mice-searching-for-answers-to-the-puzzle-of-autism/,Jake’s mice: Searching for answers to the puzzle of autism
https://businessmirror.com.ph/2021/12/29/doh-reminds-public-to-keep-safe-from-omicron-variant/,DOH reminds public to keep safe from Omicron variant
https://businessmirror.com.ph/2021/12/29/government-drums-up-efforts-for-vaccination-of-children/,Government drums up efforts for vaccination of children
https://businessmirror.com.ph/2021/12/29/pharma-founders-legacy-continues-this-christmas/,Pharma founder’s legacy continues this Christmas
https://businessmirror.com.ph/2021/12/29/astrazenecas-covid-19-vaccine-boosts-antibody-levels-vs-omicron/,AstraZeneca’s Covid-19 vaccine boosts antibody levels vs Omicron
https://businessmirror.com.ph/2021/12/29/st-lukes-medical-center-joins-efforts-to-aid-victims-of-typhoon-odette/,St. Luke’s Medical Center joins efforts to aid victims of Typhoon Odette
https://businessmirror.com.ph/2021/12/23/covid-19-vaccine-makers-hit-uneven-distribution-of-doses/,Covid-19 vaccine makers hit uneven distribution of doses
https://businessmirror.com.ph/2021/12/23/lgus-can-jump-start-smoke-free-programs-with-minimal-budget/,LGUs can jump-start smoke-free programs with minimal budget
https://businessmirror.com.ph/2021/11/10/covid-meds-arriving-in-phl-this-month/,Covid meds arriving in PHL this month
https://businessmirror.com.ph/2021/11/03/apac-employers-medical-expenses-to-go-up-in-2022/,APAC employers’ medical expenses to go up in 2022
https://businessmirror.com.ph/2021/11/03/firms-readying-workplaces-for-returning-employees/,Firms readying workplaces for returning employees
https://businessmirror.com.ph/2021/11/03/covid-19-increases-risk-of-getting-stroke-study/,Covid-19 increases risk of getting stroke–study
https://businessmirror.com.ph/2021/11/03/info-campaign-launched-for-psoriasis-awareness/,Info campaign launched for psoriasis awareness
https://businessmirror.com.ph/2021/11/03/bbm-medical-research-needs-more-support-to-fight-pandemic/,BBM: Medical research needs more support to fight pandemic
https://businessmirror.com.ph/2021/11/01/senior-citizens-are-automatic-members-of-philhealth/,Senior citizens are automatic members of PhilHealth
https://businessmirror.com.ph/2021/10/27/former-health-execs-join-clamor-to-junk-vape-bill/,Former health execs join clamor to junk vape bill
https://businessmirror.com.ph/2021/10/27/be-social-media-smart-to-deal-with-infodemic-on-covid-19/,Be social media smart to deal with infodemic on Covid-19
https://businessmirror.com.ph/2021/10/27/doh-launches-healthy-pilipinas-web-site-to-counter-misinformation-fake-news/,"DOH launches Healthy Pilipinas web site to counter misinformation, fake news"
https://businessmirror.com.ph/2021/10/27/fabric-freshener-can-kill-covid-19-virus-study/,Fabric freshener can kill Covid-19 virus–study
https://businessmirror.com.ph/2021/10/25/senior-citizen-discount-is-not-absolute/,Senior citizen discount is not absolute
https://businessmirror.com.ph/2021/10/20/its-now-safe-and-fun-to-travel-in-phl-dot/,It’s now safe and fun to travel in PHL–DOT
https://businessmirror.com.ph/2021/10/20/make-online-learning-more-enjoyable-with-these-tips/,Make online learning more enjoyable with these tips
https://businessmirror.com.ph/2021/10/20/eyes-forward-to-better-eye-health-in-an-ophthalmologists-eyes/,Eyes forward to better eye health in an ophthalmologist’s eyes
https://businessmirror.com.ph/2021/10/20/cigarette-smoking-is-hazardous-to-your-mental-health-expert/,Cigarette smoking is hazardous to your mental health–expert
https://businessmirror.com.ph/2021/10/13/pinoys-ready-to-take-on-new-next-normal/,"Pinoys ready to take on new, next normal"
